{
  "$schema": "../schemas/web-scope-capabilities.schema.json",
  "schemaVersion": "1.0.0",
  "contract": "ODL Data Pipe API",
  "provenance": {
    "issue": "BUI-705",
    "baselineCommit": "d0a537a7d2fc7606f8a8492a22d9c2cd6d9dc6e8",
    "note": "Non-LinkedIn values preserve the Web capability assertions in SCOPES.md at the baseline commit. LinkedIn is blocked pending live Data Pipe and Personal Server evidence."
  },
  "blockers": [
    {
      "id": "linkedin-live-output",
      "description": "LinkedIn Web scope capability is not classified without live end-to-end evidence.",
      "requiredCapture": [
        "A captured successful LinkedIn Data Pipe result showing the exact returned scope-key set.",
        "The resulting Personal Server scope inventory for the same run and user after sync."
      ]
    }
  ],
  "scopes": [
    { "scopeId": "amazon.orders", "status": "unsupported" },
    { "scopeId": "amazon.profile", "status": "unsupported" },
    { "scopeId": "chatgpt.conversations", "status": "unsupported" },
    { "scopeId": "chatgpt.memories", "status": "unsupported" },
    { "scopeId": "claude.conversations", "status": "unsupported" },
    { "scopeId": "claude.projects", "status": "unsupported" },
    { "scopeId": "doordash.orders", "status": "unsupported" },
    { "scopeId": "github.contributions", "status": "unsupported" },
    { "scopeId": "github.events", "status": "unsupported" },
    { "scopeId": "github.history", "status": "unsupported" },
    { "scopeId": "github.profile", "status": "supported" },
    { "scopeId": "github.repositories", "status": "unsupported" },
    { "scopeId": "github.starred", "status": "unsupported" },
    { "scopeId": "heb.nutrition", "status": "unsupported" },
    { "scopeId": "heb.orders", "status": "unsupported" },
    { "scopeId": "heb.profile", "status": "unsupported" },
    { "scopeId": "icloud_notes.folders", "status": "unsupported" },
    { "scopeId": "icloud_notes.notes", "status": "unsupported" },
    { "scopeId": "instagram.ads", "status": "unsupported" },
    { "scopeId": "instagram.following", "status": "unsupported" },
    {
      "scopeId": "instagram.posts",
      "status": "supported",
      "limits": [
        {
          "type": "maxItems",
          "value": 150,
          "unit": "posts",
          "description": "The Web path returns at most the 150 most recent posts."
        }
      ]
    },
    { "scopeId": "instagram.profile", "status": "supported" },
    { "scopeId": "linkedin.connections", "status": "blocked", "blockerId": "linkedin-live-output" },
    { "scopeId": "linkedin.education", "status": "blocked", "blockerId": "linkedin-live-output" },
    { "scopeId": "linkedin.experience", "status": "blocked", "blockerId": "linkedin-live-output" },
    { "scopeId": "linkedin.languages", "status": "blocked", "blockerId": "linkedin-live-output" },
    { "scopeId": "linkedin.profile", "status": "blocked", "blockerId": "linkedin-live-output" },
    { "scopeId": "linkedin.skills", "status": "blocked", "blockerId": "linkedin-live-output" },
    { "scopeId": "oura.activity", "status": "unsupported" },
    { "scopeId": "oura.readiness", "status": "unsupported" },
    { "scopeId": "oura.sleep", "status": "unsupported" },
    { "scopeId": "shop.orders", "status": "unsupported" },
    { "scopeId": "spotify.playlists", "status": "unsupported" },
    { "scopeId": "spotify.profile", "status": "supported" },
    { "scopeId": "spotify.savedTracks", "status": "unsupported" },
    { "scopeId": "steam.friends", "status": "unsupported" },
    { "scopeId": "steam.games", "status": "unsupported" },
    { "scopeId": "steam.profile", "status": "unsupported" },
    { "scopeId": "uber.receipts", "status": "unsupported" },
    { "scopeId": "uber.trips", "status": "unsupported" },
    { "scopeId": "wholefoods.nutrition", "status": "unsupported" },
    { "scopeId": "wholefoods.orders", "status": "unsupported" },
    { "scopeId": "wholefoods.profile", "status": "unsupported" },
    { "scopeId": "youtube.history", "status": "unsupported" },
    { "scopeId": "youtube.likes", "status": "unsupported" },
    { "scopeId": "youtube.playlistItems", "status": "unsupported" },
    { "scopeId": "youtube.playlists", "status": "unsupported" },
    { "scopeId": "youtube.profile", "status": "supported" },
    { "scopeId": "youtube.subscriptions", "status": "unsupported" },
    { "scopeId": "youtube.watchLater", "status": "unsupported" }
  ]
}
